"科目","名称(氏名)","所在地(住所)","期末現在高","摘要"
"未収入金","みずほファクター株式会社","東京都千代田区丸の内1-6-27F","708476318","ファクタリング債権"
"未収入金","SMBCファイナンス株式会社","東京都港区三田3-5-27-7F","8520433","ファクタリング債権"
"未収入金","有限会社エステック","神奈川県川崎市高津区子母口430","1978765","遅延損害金"
"未収入金","","","1350669","貸付金利息"
"未収入金","TAIKIMANUFACTURING(MALAYSHIA)SDN.BHD","1503,LorongPerusahaanMajuPraiIndustrialEstate,Perai,Penang,Malaysia","952000","技術指導料源泉税"
"未収入金","株式会社レナウン","東京都江東区有明3-6-11TFTビル東館6F","3006191","第二回中間配当"
"未収入金","その他8件","","585763",""
"未収入金計","","","724870139",""
